{
  "id": "https://heritalise-eccch.eu/resource/aggregation/great-gallery-painting-014",
  "type": "Aggregation",
  "aggregatedCHO": "https://heritalise-eccch.eu/resource/object/great-gallery-painting-014",
  "isShownBy": "https://heritalise-eccch.eu/resource/digital/great-gallery-painting-014-photo-01",
  "isShownAt": "https://www.lavenaria.it/en/collections/great-gallery-ceiling",
  "object": "https://heritalise-eccch.eu/resource/digital/great-gallery-painting-014-thumb",
  "dataProvider": "Reggia di Venaria",
  "provider": "ECCCH",
  "rights": "https://rightsstatements.org/page/InC/1.0/"
}